{
  "$schema": "http://json-schema.org/draft-07/schema#",
  "$id": "sprint_contract.schema.json",
  "title": "Sprint Contract",
  "description": "Machine-readable acceptance criteria for a sprint. Created during planning, graded by autonomous sessions or /review command.",
  "type": "object",
  "required": ["sprint", "goal", "acceptance_criteria"],
  "additionalProperties": false,
  "properties": {
    "sprint": {
      "type": "integer",
      "minimum": 0,
      "description": "Sprint number (sequential within the contract set)"
    },
    "goal": {
      "type": "string",
      "minLength": 1,
      "description": "One-line sprint goal"
    },
    "depends_on": {
      "type": "array",
      "items": {
        "type": "string"
      },
      "description": "Contract IDs that must be merged before this contract can execute (e.g., ['M02a', 'M01'])"
    },
    "layer": {
      "type": "string",
      "description": "Primary layer(s) affected: go, frontend, python, db, tests, or combinations like go+frontend"
    },
    "acceptance_criteria": {
      "type": "array",
      "minItems": 1,
      "items": {
        "type": "object",
        "required": ["id", "description", "verification"],
        "additionalProperties": false,
        "properties": {
          "id": {
            "type": "string",
            "pattern": "^AC-[0-9]+$",
            "description": "Unique criterion ID (e.g., AC-1, AC-2)"
          },
          "description": {
            "type": "string",
            "minLength": 1,
            "description": "What must be true for this criterion to pass"
          },
          "verification": {
            "type": "string",
            "minLength": 1,
            "description": "How to verify — test command, manual check, or inspection"
          }
        }
      }
    },
    "regression_gates": {
      "type": "array",
      "items": {
        "type": "string",
        "pattern": "^R-[0-9]+$"
      },
      "description": "Regression test IDs that must pass (e.g., R-01, R-10)"
    },
    "design_review_rubric": {
      "type": "object",
      "additionalProperties": false,
      "properties": {
        "critical": {
          "type": "array",
          "items": { "type": "string" },
          "description": "Must resolve before implementing — blocks code phase"
        },
        "high": {
          "type": "array",
          "items": { "type": "string" },
          "description": "Resolve when feasible — reviewer flags but doesn't block"
        },
        "medium": {
          "type": "array",
          "items": { "type": "string" },
          "description": "Document as known limitation if not resolved"
        }
      },
      "description": "Domain-specific design review criteria (supplements standard rubric)"
    },
    "quality_workflow": {
      "type": "array",
      "items": { "type": "string" },
      "description": "Slash commands to run in Phase 4 Refactor quality gates (e.g., ['/validate', '/simplify', '/validate', '/precommit'])"
    },
    "files_hint": {
      "type": "array",
      "items": { "type": "string" },
      "description": "Files likely to be created or modified (guidance, not prescriptive)"
    },
    "persona_review_required": {
      "type": "boolean",
      "default": false,
      "description": "Whether persona review is required for this sprint"
    }
  }
}
