{
  "sprint": 4,
  "goal": "Job queue: API handlers for job listing, cancellation, and monitoring",
  "depends_on": ["M02b"],
  "layer": "go",
  "acceptance_criteria": [
    {
      "id": "AC-1",
      "description": "GET /api/v1/migration/engagements/{id}/jobs returns paginated job list with status, type, created_at, started_at, completed_at, retry_count",
      "verification": "cd platform/migration && go test ./api/... -run TestListJobs -count=1 -v"
    },
    {
      "id": "AC-2",
      "description": "GET /api/v1/migration/engagements/{id}/jobs/{jobId} returns full job detail including payload and last_error",
      "verification": "cd platform/migration && go test ./api/... -run TestGetJob -count=1 -v"
    },
    {
      "id": "AC-3",
      "description": "POST /api/v1/migration/engagements/{id}/jobs/{jobId}/cancel transitions PENDING or RETRYING jobs to FAILED with cancellation reason. Returns 409 for RUNNING or already-terminal jobs.",
      "verification": "cd platform/migration && go test ./api/... -run TestCancelJob -count=1 -v"
    },
    {
      "id": "AC-4",
      "description": "POST /api/v1/migration/engagements/{id}/jobs/{jobId}/retry resets a FAILED job to PENDING with retry_count reset. Returns 409 for non-FAILED jobs.",
      "verification": "cd platform/migration && go test ./api/... -run TestRetryJob -count=1 -v"
    },
    {
      "id": "AC-5",
      "description": "GET /api/v1/migration/engagements/{id}/jobs/summary returns counts by status (pending, running, completed, failed) and avg execution time",
      "verification": "cd platform/migration && go test ./api/... -run TestJobSummary -count=1 -v"
    },
    {
      "id": "AC-6",
      "description": "All job endpoints require auth middleware. Cancel and retry require editor-or-above role.",
      "verification": "cd platform/migration && go test ./api/... -run TestJobAuth -count=1 -v"
    }
  ],
  "regression_gates": [],
  "design_review_rubric": {
    "critical": [
      "All endpoints scoped to engagement via URL param — no cross-engagement job access",
      "Cancel and retry are write operations requiring editor+ role",
      "Job list is tenant-scoped via RLS (no app-level filtering alone)",
      "Cancel a RUNNING job is rejected (409) — only the worker can stop a running job"
    ],
    "high": [
      "Pagination uses cursor-based approach (not OFFSET) for consistent results during inserts",
      "Job summary endpoint is efficient (single GROUP BY query, not N+1)",
      "WebSocket broadcasts job_cancelled event on successful cancel",
      "Tests cover auth, pagination, cancel-running (409), retry-non-failed (409)"
    ],
    "medium": [
      "Filter jobs by status and type via query params",
      "Sort jobs by created_at or priority"
    ]
  },
  "quality_workflow": ["/validate", "/simplify", "/validate", "/precommit"],
  "files_hint": [
    "platform/migration/api/job_handlers.go",
    "platform/migration/api/job_handlers_test.go",
    "platform/migration/api/routes.go",
    "platform/migration/db/job_queries.go"
  ]
}
